<?xml version="1.0" encoding="UTF-8"?>
<constraints__rogowski_coil xmlns:xsi="http://www.w3.org/2001/XMLSchema-instance" xsi:noNamespaceSchemaLocation="../../../settings_schema/xsd/equilibrium/constraints_rogowski_coil.xsd">
    <rogowski_coil>
        <name>INIVC000</name>
        <expected_value>306917.4849</expected_value>
        <weight>1000.0</weight>
        <include>true</include>
        <comment/>
    </rogowski_coil>
    <rogowski_coil>
        <name>MCT</name>
        <expected_value>-5616.681085</expected_value>
        <weight>1.0</weight>
        <include>false</include>
        <comment/>
    </rogowski_coil>
    <rogowski_coil>
        <name>MCB</name>
        <expected_value>-5616.681085</expected_value>
        <weight>1.0</weight>
        <include>false</include>
        <comment/>
    </rogowski_coil>
    <rogowski_coil>
        <name>BVLT</name>
        <expected_value>-148704.9999</expected_value>
        <weight>1000.0</weight>
        <include>true</include>
        <comment/>
    </rogowski_coil>
    <rogowski_coil>
        <name>BVLB</name>
        <expected_value>-148704.9999</expected_value>
        <weight>1000.0</weight>
        <include>true</include>
        <comment/>
    </rogowski_coil>
    <rogowski_coil>
        <name>GASBFLT</name>
        <expected_value>4281.590177</expected_value>
        <weight>100.0</weight>
        <include>true</include>
        <comment/>
    </rogowski_coil>
    <rogowski_coil>
        <name>GASBFLB</name>
        <expected_value>4281.590177</expected_value>
        <weight>100.0</weight>
        <include>true</include>
        <comment/>
    </rogowski_coil>
    <rogowski_coil>
        <name>DIVT</name>
        <expected_value>-927749.4327</expected_value>
        <weight>1000.0</weight>
        <include>false</include>
        <comment>presently, I am not reconstructing the DIV cases, so makes no sense to include case Rogowski</comment>
    </rogowski_coil>
    <rogowski_coil>
        <name>DIVB</name>
        <expected_value>-927749.4327</expected_value>
        <weight>1000.0</weight>
        <include>false</include>
        <comment>presently, I am not reconstructing the DIV cases, so makes no sense to include case Rogowski</comment>
    </rogowski_coil>
    <rogowski_coil>
        <name>HFSPSRT</name>
        <expected_value>1000.0</expected_value>
        <weight>1000000.0</weight>
        <include>true</include>
        <comment/>
    </rogowski_coil>
    <rogowski_coil>
        <name>HFSPSRB</name>
        <expected_value>1000.0</expected_value>
        <weight>1000000.0</weight>
        <include>true</include>
        <comment/>
    </rogowski_coil>
    <rogowski_coil>
        <name>DIVPSRT</name>
        <expected_value>1000.0</expected_value>
        <weight>1000.0</weight>
        <include>true</include>
        <comment/>
    </rogowski_coil>
    <rogowski_coil>
        <name>DIVPSRB</name>
        <expected_value>1000.0</expected_value>
        <weight>1000.0</weight>
        <include>true</include>
        <comment/>
    </rogowski_coil>
</constraints__rogowski_coil>
